{"$schema":"https://json-schema.org/draft/2020-12/schema","$id":"https://bantai-education-design.github.io/tools/university-database/university.schema.json","title":"Ban.Tai University Database Common Schema v1.0","description":"大学1校あたりの完成形データ契約。全国大学DBで共通利用する。","type":"object","additionalProperties":false,"required":["schema_version","university_id","name","establishment_type","status","official_url","student_counts","academics","graduate_schools","campuses","tuition","admissions","qualifications","careers","research","sports_culture","notable_alumni","sources","verification"],"properties":{"schema_version":{"const":"1.0"},"university_id":{"type":"string","pattern":"^u[0-9]{6}$","description":"永続大学ID"},"id":{"type":["string","null"],"pattern":"^u[0-9]{6}$","description":"既存生成データ互換用の旧キー。新規データでは university_id を正とする。"},"name":{"type":"string","minLength":1},"name_kana":{"type":["string","null"]},"name_en":{"type":["string","null"]},"establishment_type":{"enum":["national","public","private"]},"status":{"enum":["active","admissions_stopped","closed","planned"]},"prefecture":{"type":["string","null"]},"municipality":{"type":["string","null"]},"operator":{"type":["string","null"]},"founded_year":{"type":["integer","null"],"minimum":1000,"maximum":9999},"opened_year":{"type":["integer","null"],"minimum":1000,"maximum":9999},"founder":{"type":["string","null"]},"philosophy":{"type":["string","null"]},"mission":{"type":["string","null"]},"history_summary":{"type":["string","null"]},"feature_summary":{"type":["string","null"]},"official_url":{"type":"string","format":"uri"},"admissions_url":{"type":["string","null"],"format":"uri"},"application_guidelines_url":{"type":["string","null"],"format":"uri"},"brochure_request_url":{"type":["string","null"],"format":"uri"},"open_campus_url":{"type":["string","null"],"format":"uri"},"student_counts":{"$ref":"#/$defs/studentCounts"},"academic_field_tags":{"type":"array","items":{"type":"string","minLength":1},"uniqueItems":true},"academics":{"type":"array","items":{"$ref":"#/$defs/faculty"}},"graduate_schools":{"type":"array","items":{"$ref":"#/$defs/graduateSchool"}},"campuses":{"type":"array","items":{"$ref":"#/$defs/campus"}},"tuition":{"type":"array","items":{"$ref":"#/$defs/tuitionRecord"}},"admissions":{"$ref":"#/$defs/admissions"},"qualifications":{"type":"array","items":{"$ref":"#/$defs/qualification"}},"careers":{"$ref":"#/$defs/careers"},"research":{"$ref":"#/$defs/research"},"sports_culture":{"type":"array","items":{"$ref":"#/$defs/sportsCulture"}},"notable_alumni":{"type":"array","items":{"$ref":"#/$defs/alumnus"}},"sources":{"type":"array","items":{"$ref":"#/$defs/source"}},"verification":{"$ref":"#/$defs/verification"}},"$defs":{"studentCounts":{"type":"object","additionalProperties":false,"properties":{"undergraduate":{"type":["integer","null"],"minimum":0},"graduate":{"type":["integer","null"],"minimum":0},"other":{"type":["integer","null"],"minimum":0},"total":{"type":["integer","null"],"minimum":0},"as_of":{"type":["string","null"],"format":"date"},"source_id":{"type":["string","null"]}}},"program":{"type":"object","additionalProperties":false,"required":["program_id","name","type"],"properties":{"program_id":{"type":"string","pattern":"^p[0-9]{6}$"},"name":{"type":"string","minLength":1},"type":{"enum":["major","course","program","specialization","track"]},"academic_field_tags":{"type":"array","items":{"type":"string"},"uniqueItems":true},"source_id":{"type":["string","null"]}}},"department":{"type":"object","additionalProperties":false,"required":["department_id","name","programs"],"properties":{"department_id":{"type":"string","pattern":"^d[0-9]{6}$"},"name":{"type":"string","minLength":1},"academic_field_tags":{"type":"array","items":{"type":"string"},"uniqueItems":true},"programs":{"type":"array","items":{"$ref":"#/$defs/program"}},"source_id":{"type":["string","null"]}}},"faculty":{"type":"object","additionalProperties":false,"required":["faculty_id","name","departments"],"properties":{"faculty_id":{"type":"string","pattern":"^f[0-9]{6}$"},"name":{"type":"string","minLength":1},"academic_field_tags":{"type":"array","items":{"type":"string"},"uniqueItems":true},"campus_ids":{"type":"array","items":{"type":"string","pattern":"^c[0-9]{6}$"},"uniqueItems":true},"departments":{"type":"array","items":{"$ref":"#/$defs/department"}},"source_id":{"type":["string","null"]}}},"graduateProgram":{"type":"object","additionalProperties":false,"required":["program_id","name"],"properties":{"program_id":{"type":"string","pattern":"^gp[0-9]{6}$"},"name":{"type":"string","minLength":1},"course_type":{"enum":["master","doctoral","professional","integrated","other"]},"source_id":{"type":["string","null"]}}},"graduateSchool":{"type":"object","additionalProperties":false,"required":["graduate_school_id","name","programs"],"properties":{"graduate_school_id":{"type":"string","pattern":"^g[0-9]{6}$"},"name":{"type":"string","minLength":1},"campus_ids":{"type":"array","items":{"type":"string","pattern":"^c[0-9]{6}$"},"uniqueItems":true},"programs":{"type":"array","items":{"$ref":"#/$defs/graduateProgram"}},"source_id":{"type":["string","null"]}}},"station":{"type":"object","additionalProperties":false,"required":["station"],"properties":{"station":{"type":"string","minLength":1},"line":{"type":["string","null"]},"access":{"type":["string","null"]},"walk_minutes":{"type":["integer","null"],"minimum":0}}},"campus":{"type":"object","additionalProperties":false,"required":["campus_id","name","prefecture","municipality","address","nearest_stations","faculty_ids"],"properties":{"campus_id":{"type":"string","pattern":"^c[0-9]{6}$"},"name":{"type":"string","minLength":1},"postal_code":{"type":["string","null"]},"prefecture":{"type":"string","minLength":1},"municipality":{"type":"string","minLength":1},"address":{"type":"string","minLength":1},"latitude":{"type":["number","null"],"minimum":-90,"maximum":90},"longitude":{"type":["number","null"],"minimum":-180,"maximum":180},"nearest_stations":{"type":"array","items":{"$ref":"#/$defs/station"}},"faculty_ids":{"type":"array","items":{"type":"string","pattern":"^f[0-9]{6}$"},"uniqueItems":true},"official_url":{"type":["string","null"],"format":"uri"},"source_id":{"type":["string","null"]}}},"tuitionRecord":{"type":"object","additionalProperties":false,"required":["academic_year","currency"],"properties":{"academic_year":{"type":"integer","minimum":2000,"maximum":2200},"faculty_id":{"type":["string","null"],"pattern":"^f[0-9]{6}$"},"department_id":{"type":["string","null"],"pattern":"^d[0-9]{6}$"},"program_id":{"type":["string","null"]},"admission_fee":{"type":["integer","null"],"minimum":0},"annual_tuition":{"type":["integer","null"],"minimum":0},"facility_fee":{"type":["integer","null"],"minimum":0},"other_fees":{"type":["integer","null"],"minimum":0},"first_year_total":{"type":["integer","null"],"minimum":0},"currency":{"const":"JPY"},"as_of":{"type":["string","null"],"format":"date"},"source_id":{"type":["string","null"]}}},"admissionMethod":{"type":"object","additionalProperties":false,"required":["method_id","category","name"],"properties":{"method_id":{"type":"string","pattern":"^a[0-9]{6}$"},"faculty_id":{"type":["string","null"],"pattern":"^f[0-9]{6}$"},"department_id":{"type":["string","null"],"pattern":"^d[0-9]{6}$"},"program_id":{"type":["string","null"]},"category":{"enum":["general","common_test","recommendation","comprehensive","special","international","transfer","other"]},"name":{"type":"string","minLength":1},"quota":{"type":["integer","null"],"minimum":0},"application_period":{"type":["string","null"]},"exam_date":{"type":["string","null"]},"result_date":{"type":["string","null"]},"subjects":{"type":"array","items":{"type":"string"}},"common_test_required":{"type":["boolean","null"]},"official_url":{"type":["string","null"],"format":"uri"},"source_id":{"type":["string","null"]}}},"admissions":{"type":"object","additionalProperties":false,"required":["admission_year","methods"],"properties":{"admission_year":{"type":["integer","null"],"minimum":2000,"maximum":2200},"web_application_url":{"type":["string","null"],"format":"uri"},"application_guidelines_url":{"type":["string","null"],"format":"uri"},"admissions_url":{"type":["string","null"],"format":"uri"},"methods":{"type":"array","items":{"$ref":"#/$defs/admissionMethod"}}}},"qualification":{"type":"object","additionalProperties":false,"required":["name","type"],"properties":{"name":{"type":"string","minLength":1},"type":{"enum":["national_license","teaching_license","examination_eligibility","certification","other"]},"faculty_id":{"type":["string","null"],"pattern":"^f[0-9]{6}$"},"department_id":{"type":["string","null"],"pattern":"^d[0-9]{6}$"},"program_id":{"type":["string","null"]},"condition":{"type":["string","null"]},"source_id":{"type":["string","null"]}}},"examResult":{"type":"object","additionalProperties":false,"required":["name","year"],"properties":{"name":{"type":"string","minLength":1},"year":{"type":"integer","minimum":2000,"maximum":2200},"examinees":{"type":["integer","null"],"minimum":0},"passers":{"type":["integer","null"],"minimum":0},"pass_rate":{"type":["number","null"],"minimum":0,"maximum":100},"source_id":{"type":["string","null"]}}},"careers":{"type":"object","additionalProperties":false,"properties":{"employment_rate":{"type":["number","null"],"minimum":0,"maximum":100},"employment_rate_as_of":{"type":["string","null"],"format":"date"},"graduate_school_rate":{"type":["number","null"],"minimum":0,"maximum":100},"main_employers":{"type":"array","items":{"type":"string"}},"main_career_fields":{"type":"array","items":{"type":"string"}},"national_exam_results":{"type":"array","items":{"$ref":"#/$defs/examResult"}},"source_ids":{"type":"array","items":{"type":"string"},"uniqueItems":true}}},"researchItem":{"type":"object","additionalProperties":false,"required":["title"],"properties":{"title":{"type":"string","minLength":1},"summary":{"type":["string","null"]},"field_tags":{"type":"array","items":{"type":"string"},"uniqueItems":true},"source_id":{"type":["string","null"]}}},"research":{"type":"object","additionalProperties":false,"properties":{"strengths":{"type":"array","items":{"$ref":"#/$defs/researchItem"}},"institutes":{"type":"array","items":{"$ref":"#/$defs/researchItem"}},"notable_projects":{"type":"array","items":{"$ref":"#/$defs/researchItem"}},"awards":{"type":"array","items":{"$ref":"#/$defs/researchItem"}}}},"sportsCulture":{"type":"object","additionalProperties":false,"required":["category","organization","achievement"],"properties":{"category":{"enum":["sports","culture","music","arts","competition","other"]},"organization":{"type":"string","minLength":1},"achievement":{"type":"string","minLength":1},"year":{"type":["integer","null"],"minimum":1900,"maximum":2200},"level":{"enum":["international","national","regional","university","other",null]},"source_id":{"type":["string","null"]}}},"alumnus":{"type":"object","additionalProperties":false,"required":["name","field","source_id"],"properties":{"name":{"type":"string","minLength":1},"field":{"type":"string","minLength":1},"affiliation_note":{"type":["string","null"]},"graduation_year":{"type":["integer","null"],"minimum":1800,"maximum":2200},"source_id":{"type":"string","minLength":1}}},"source":{"type":"object","additionalProperties":false,"required":["source_id","title","url","publisher","source_type","verified_at","status"],"properties":{"source_id":{"type":"string","pattern":"^src[0-9]{3,}$"},"title":{"type":"string","minLength":1},"url":{"type":"string","format":"uri"},"publisher":{"type":"string","minLength":1},"source_type":{"enum":["official_university","government","official_organization","person_official","other_primary","secondary"]},"published_at":{"type":["string","null"],"format":"date"},"verified_at":{"type":"string","format":"date"},"status":{"enum":["active","archived","broken","superseded"]}}},"verification":{"type":"object","additionalProperties":false,"required":["last_verified_at","verification_status","verified_sections","pending_sections"],"properties":{"last_verified_at":{"type":"string","format":"date"},"verification_status":{"enum":["verified","partial","needs_review"]},"verified_sections":{"type":"array","items":{"enum":["basic","academics","campuses","tuition","admissions","qualifications","careers","research","sports_culture","notable_alumni"]},"uniqueItems":true},"pending_sections":{"type":"array","items":{"enum":["basic","academics","campuses","tuition","admissions","qualifications","careers","research","sports_culture","notable_alumni"]},"uniqueItems":true},"notes":{"type":["string","null"]}}}}}
