{"schema_version":"1.0","university_id":"u000002","id":"u000002","name":"東京外国語大学","name_kana":"とうきょうがいこくごだいがく","name_en":"Tokyo University of Foreign Studies","establishment_type":"national","status":"active","prefecture":"東京都","municipality":"府中市","operator":"国立大学法人東京外国語大学","founded_year":1873,"opened_year":1949,"founder":null,"philosophy":"世界の言語と、それを基底とする文化・社会について教育研究を行い、異なる文化的背景をもつ人々と協働して地球的課題に取り組める人材の育成を重視します。","mission":"高度な言語運用能力、世界諸地域への知識・教養、専門的知識、主体的に考え行動し発信する力を育み、多言語・多文化社会に貢献する人材を養成します。","history_summary":"1873年に官立の東京外国語学校として建学。戦後の新制学制により1949年に4年制の東京外国語大学が発足し、言語だけでなく文化・社会を含む総合的な外国研究を掲げてきました。","feature_summary":"27の専攻言語を入口に世界各地域の言語・文化・社会を学び、言語文化学部・国際社会学部・国際日本学部の3学部で、語学、地域研究、国際関係、日本研究を深める国立大学です。留学・国際交流と地域研究の研究拠点を備えています。","official_url":"https://www.tufs.ac.jp/","admissions_url":"https://www.tufs.ac.jp/admission/exam/guideline/","application_guidelines_url":"https://www.tufs.ac.jp/admission/exam/guideline/","brochure_request_url":null,"open_campus_url":"https://www.tufs.ac.jp/admission/events/opencampus.html","student_counts":{"undergraduate":3766,"graduate":502,"other":null,"total":4268,"as_of":"2026-05-01","source_id":"src2001"},"academic_field_tags":["国際・語学","文学・人文","社会学","国際関係","地域研究","日本研究","教育"],"academics":[{"faculty_id":"f020001","name":"言語文化学部","academic_field_tags":["国際・語学","文学・人文","地域研究"],"campus_ids":["c020001"],"departments":[{"department_id":"d020001","name":"言語文化学科","academic_field_tags":["国際・語学","文学・人文","地域研究"],"programs":[{"program_id":"p020001","name":"英語（専攻言語）","type":"specialization","source_id":"src2002"},{"program_id":"p020002","name":"ドイツ語（専攻言語）","type":"specialization","source_id":"src2002"},{"program_id":"p020003","name":"ポーランド語（専攻言語）","type":"specialization","source_id":"src2002"},{"program_id":"p020004","name":"チェコ語（専攻言語）","type":"specialization","source_id":"src2002"},{"program_id":"p020005","name":"フランス語（専攻言語）","type":"specialization","source_id":"src2002"},{"program_id":"p020006","name":"イタリア語（専攻言語）","type":"specialization","source_id":"src2002"},{"program_id":"p020007","name":"スペイン語（専攻言語）","type":"specialization","source_id":"src2002"},{"program_id":"p020008","name":"ポルトガル語（専攻言語）","type":"specialization","source_id":"src2002"},{"program_id":"p020009","name":"ロシア語（専攻言語）","type":"specialization","source_id":"src2002"},{"program_id":"p020010","name":"ロシア語及びウズベク語（専攻言語）","type":"specialization","source_id":"src2002"},{"program_id":"p020011","name":"モンゴル語（専攻言語）","type":"specialization","source_id":"src2002"},{"program_id":"p020012","name":"中国語（専攻言語）","type":"specialization","source_id":"src2002"},{"program_id":"p020013","name":"朝鮮語（専攻言語）","type":"specialization","source_id":"src2002"},{"program_id":"p020014","name":"インドネシア語（専攻言語）","type":"specialization","source_id":"src2002"},{"program_id":"p020015","name":"マレーシア語（専攻言語）","type":"specialization","source_id":"src2002"},{"program_id":"p020016","name":"フィリピン語（専攻言語）","type":"specialization","source_id":"src2002"},{"program_id":"p020017","name":"タイ語（専攻言語）","type":"specialization","source_id":"src2002"},{"program_id":"p020018","name":"ラオス語（専攻言語）","type":"specialization","source_id":"src2002"},{"program_id":"p020019","name":"ベトナム語（専攻言語）","type":"specialization","source_id":"src2002"},{"program_id":"p020020","name":"カンボジア語（専攻言語）","type":"specialization","source_id":"src2002"},{"program_id":"p020021","name":"ビルマ語（専攻言語）","type":"specialization","source_id":"src2002"},{"program_id":"p020022","name":"ウルドゥー語（専攻言語）","type":"specialization","source_id":"src2002"},{"program_id":"p020023","name":"ヒンディー語（専攻言語）","type":"specialization","source_id":"src2002"},{"program_id":"p020024","name":"ベンガル語（専攻言語）","type":"specialization","source_id":"src2002"},{"program_id":"p020025","name":"アラビア語（専攻言語）","type":"specialization","source_id":"src2002"},{"program_id":"p020026","name":"ペルシア語（専攻言語）","type":"specialization","source_id":"src2002"},{"program_id":"p020027","name":"トルコ語（専攻言語）","type":"specialization","source_id":"src2002"},{"program_id":"p020028","name":"地域コース","type":"course","source_id":"src2003"},{"program_id":"p020029","name":"超域コース","type":"course","source_id":"src2003"}],"source_id":"src2003"}],"source_id":"src2003"},{"faculty_id":"f020002","name":"国際社会学部","academic_field_tags":["社会学","国際関係","地域研究"],"campus_ids":["c020001"],"departments":[{"department_id":"d020002","name":"国際社会学科","academic_field_tags":["社会学","国際関係","地域研究"],"programs":[{"program_id":"p020030","name":"北西ヨーロッパ／北アメリカ（専攻地域）","type":"specialization","source_id":"src2002"},{"program_id":"p020031","name":"中央ヨーロッパ（専攻地域）","type":"specialization","source_id":"src2002"},{"program_id":"p020032","name":"西南ヨーロッパ（専攻地域）","type":"specialization","source_id":"src2002"},{"program_id":"p020033","name":"イベリア／ラテンアメリカ（専攻地域）","type":"specialization","source_id":"src2002"},{"program_id":"p020034","name":"ロシア（専攻地域）","type":"specialization","source_id":"src2002"},{"program_id":"p020035","name":"中央アジア（専攻地域）","type":"specialization","source_id":"src2002"},{"program_id":"p020036","name":"東アジア（専攻地域）","type":"specialization","source_id":"src2002"},{"program_id":"p020037","name":"東南アジア第1（専攻地域）","type":"specialization","source_id":"src2002"},{"program_id":"p020038","name":"東南アジア第2（専攻地域）","type":"specialization","source_id":"src2002"},{"program_id":"p020039","name":"南アジア（専攻地域）","type":"specialization","source_id":"src2002"},{"program_id":"p020040","name":"中東（専攻地域）","type":"specialization","source_id":"src2002"},{"program_id":"p020041","name":"アフリカ（専攻地域）","type":"specialization","source_id":"src2002"},{"program_id":"p020042","name":"オセアニア（専攻地域）","type":"specialization","source_id":"src2002"},{"program_id":"p020043","name":"地域社会研究コース","type":"course","source_id":"src2004"},{"program_id":"p020044","name":"現代世界論コース","type":"course","source_id":"src2004"},{"program_id":"p020045","name":"国際関係コース","type":"course","source_id":"src2004"}],"source_id":"src2004"}],"source_id":"src2004"},{"faculty_id":"f020003","name":"国際日本学部","academic_field_tags":["日本研究","国際関係","教育"],"campus_ids":["c020001"],"departments":[{"department_id":"d020003","name":"国際日本学科","academic_field_tags":["日本研究","国際関係","教育"],"programs":[{"program_id":"p020046","name":"日本社会分野","type":"specialization","source_id":"src2005"},{"program_id":"p020047","name":"日本文学・文化分野","type":"specialization","source_id":"src2005"},{"program_id":"p020048","name":"日本語学分野","type":"specialization","source_id":"src2005"},{"program_id":"p020049","name":"日本語教育学分野","type":"specialization","source_id":"src2005"}],"source_id":"src2005"}],"source_id":"src2005"}],"graduate_schools":[{"graduate_school_id":"g020001","name":"大学院総合国際学研究科","campus_ids":["c020001"],"programs":[{"program_id":"gp020001","name":"世界言語社会専攻・言語文化コース","course_type":"master","source_id":"src2006"},{"program_id":"gp020002","name":"世界言語社会専攻・国際社会コース","course_type":"master","source_id":"src2006"},{"program_id":"gp020003","name":"世界言語社会専攻・Peace and Conflict Studies（PCS）コース","course_type":"master","source_id":"src2006"},{"program_id":"gp020004","name":"国際日本専攻・国際日本コース","course_type":"master","source_id":"src2006"},{"program_id":"gp020005","name":"国際日本専攻・日本語教育リカレントコース","course_type":"master","source_id":"src2006"},{"program_id":"gp020006","name":"世界言語社会専攻","course_type":"doctoral","source_id":"src2006"},{"program_id":"gp020007","name":"国際日本専攻","course_type":"doctoral","source_id":"src2006"},{"program_id":"gp020008","name":"共同サステイナビリティ研究専攻","course_type":"doctoral","source_id":"src2006"}],"source_id":"src2006"}],"campuses":[{"campus_id":"c020001","name":"府中キャンパス","postal_code":"183-8534","prefecture":"東京都","municipality":"府中市","address":"東京都府中市朝日町3-11-1","latitude":null,"longitude":null,"nearest_stations":[{"station":"多磨駅","line":"西武多摩川線","access":"徒歩5分","walk_minutes":5},{"station":"飛田給駅","line":"京王線","access":"北口から京王バス約10分、『東京外国語大学前』下車","walk_minutes":null}],"faculty_ids":["f020001","f020002","f020003"],"official_url":"https://www.tufs.ac.jp/abouttufs/contactus/access.html","source_id":"src2007"},{"campus_id":"c020002","name":"本郷サテライト","postal_code":"113-0033","prefecture":"東京都","municipality":"文京区","address":"東京都文京区本郷2-14-10","latitude":null,"longitude":null,"nearest_stations":[{"station":"本郷三丁目駅","line":"東京メトロ丸ノ内線・都営大江戸線","access":"徒歩5分","walk_minutes":5},{"station":"御茶ノ水駅","line":"JR中央線・総武線","access":"徒歩10分","walk_minutes":10}],"faculty_ids":[],"official_url":"https://www.tufs.ac.jp/abouttufs/contactus/access.html","source_id":"src2007"}],"tuition":[{"academic_year":2026,"faculty_id":null,"department_id":null,"program_id":null,"admission_fee":282000,"annual_tuition":535800,"facility_fee":null,"other_fees":null,"first_year_total":817800,"currency":"JPY","as_of":"2026-08-22","source_id":"src2008"}],"admissions":{"admission_year":2027,"web_application_url":null,"application_guidelines_url":"https://www.tufs.ac.jp/admission/exam/guideline/","admissions_url":"https://www.tufs.ac.jp/admission/exam/guideline/","methods":[{"method_id":"a020001","faculty_id":null,"department_id":null,"program_id":null,"category":"general","name":"一般選抜（前期日程）","quota":579,"application_period":"2027年1月25日～2月3日","exam_date":"2027年2月25日","result_date":"2027年3月6日","subjects":[],"common_test_required":true,"official_url":"https://www.tufs.ac.jp/admission/exam/guideline/general-zenki.html","source_id":"src2002"},{"method_id":"a020002","faculty_id":"f020002","department_id":"d020002","program_id":null,"category":"general","name":"一般選抜（後期日程・国際社会学部）","quota":56,"application_period":"2027年1月25日～2月3日","exam_date":"2027年3月12日","result_date":"2027年3月20日","subjects":[],"common_test_required":true,"official_url":"https://www.tufs.ac.jp/admission/exam/guideline/general-kouki.html","source_id":"src2002"},{"method_id":"a020003","faculty_id":null,"department_id":null,"program_id":null,"category":"recommendation","name":"学校推薦型選抜","quota":80,"application_period":"2026年11月1日～5日","exam_date":"2026年11月28日・29日","result_date":"2026年12月16日","subjects":[],"common_test_required":false,"official_url":"https://www.tufs.ac.jp/admission/exam/guideline/suisen.html","source_id":"src2002"